title,url,description,publishedAt,source,text,summary,keywords
"Country's GDP expected to grow due to high foreign investment, says Finance Ministry",https://www.thestar.com.my/news/nation/2026/05/18/country039s-gdp-growth-expected-to-grow-due-to-high-foreign-investment-says-finance-ministry,"GEORGE TOWN: Malaysia is expecting positive Gross Domestic Product (GDP) growth due to the inflow of foreign and domestic investments that remain strong, in addition to high demand for the artificial intelligence (AI), data centres and the semiconductor sectors that continue to drive the economy, says Datuk Seri Amir Hamzah Azizan.",2026-05-18T08:26:00Z,The Star,"GEORGE TOWN: Malaysia is expecting positive Gross Domestic Product (GDP) growth due to the inflow of foreign and domestic investments that remain strong, in addition to high demand for the artificial intelligence (AI), data centres and the semiconductor sectors that continue to drive the economy, says Datuk Seri Amir Hamzah Azizan.

The Finance Minister II said the government is working hard to ensure that engines driving the economy continue to operate smoothly, which is why the country remains attractive to investors.

He the country's GDP growth remained strong for the first quarter of the 2026, recording a 5.4% increase.

""Foreign direct investment (FDI) is coming in and it has started contributing to our GDP growth.

""Domestic direct investment (DDI) within the country remains strong as well, while public spending is still robust,"" he said during a press conference after visiting the Intel Pelican Project in Bayan Lepas on Monday (May 18).

He said the Federal government is pave the way for domestic investors, especially government-linked investment companies (GLIC) and government-linked companies (GLC) to invest in the country.

""We have an existing strong ecosystem especially here in the northern region, which can be attributed to investors' confidence in Malaysia.

""The government's focus is on further strengthening the ecosystem, attract investors, generate new jobs and ensure that those coming in can help Malaysia continue grow,"" he said.

Amir Hamzah said the government is focusing on increasing the people's income, including moving from minimum wage to living wage and salary increases for civil servants which has helped stimulate consumer spending.

""When income increases, the community's purchasing power also increases and this helps boost the domestic economy,"" he said.

Commenting on the technology sector, he said that demand for AI, data centres and semiconductors is still high, especially in the northern region of the peninsula, which has a complete industrial ecosystem.

""Malaysia continues to be the choice for global investors because it has a mature industrial chain and the ability to support the development of the digital and high-tech sectors.

""The government will continue to build an ecosystem that helps bring in investors, establish themselves and grow in Malaysia which will continue to strengthen the country's position as a regional semiconductor hub,"" he said.","He the country's GDP growth remained strong for the first quarter of the 2026, recording a 5.4% increase.
""Foreign direct investment (FDI) is coming in and it has started contributing to our GDP growth.
He said the Federal government is pave the way for domestic investors, especially government-linked investment companies (GLIC) and government-linked companies (GLC) to invest in the country.
""We have an existing strong ecosystem especially here in the northern region, which can be attributed to investors' confidence in Malaysia.
""The government's focus is on further strengthening the ecosystem, attract investors, generate new jobs and ensure that those coming in can help Malaysia continue grow,"" he said.","['malaysia', 'finance', 'high', 'especially', 'grow', 'increases', 'expected', 'investors', 'strong', 'ecosystem', 'countrys', 'domestic', 'gdp', 'continue', 'investment', 'ministry', 'foreign']"
Malaysia's 1Q GDP comes in at 5.4%,https://www.thestar.com.my/business/business-news/2026/05/15/malaysia039s-1q-gdp-comes-in-at-54,"KUALA LUMPUR: Malaysia's gross domestic product (GDP) grew at a slightly faster-than-anticipated rate of 5.4% in the first quarter of 2026, as economic growth moderated from 6.3% in the preceding quarter last year.",2026-05-15T04:08:00Z,The Star,"KUALA LUMPUR: Malaysia's gross domestic product (GDP) grew at a slightly faster-than-anticipated rate of 5.4% in the first quarter of 2026, as economic growth moderated from 6.2% in the preceding quarter last year.

Advance estimates had pegged the growth rate at 5.3%, with analysts anticipating the normalisation of growth following strong year-end expansion in 2025, particularly in construction and services.

“Malaysia’s economy continued to expand in the first quarter of 2026, reflecting underlying resilience and stable growth conditions amid a challenging global environment.

""While most major sectors remained on an expansionary path, the pace of growth eased following the strong performance in the preceding quarter,"" said chief statistician Datuk Dri Mohd Uzir Mahidin in a statement released by the Statistics Department.

In a separate statement, Bank Negara said quarterly headline inflation increased to 1.6% from 1.3% in the previous quarter, while core inflation moderated to 2.1% from 2.3%.

According to the central bank, the higher headline inflation reflected some initial cost pass-through of higher global cost pressures, partly due to the conflict in the Middle East.

READ ALSO: Malaysia inflation edges up in March as fuel costs rise, trade growth moderates

Commenting on the country's outlook, Bank Negara governor Datuk Sri Abdul Rasheed Ghafffour said Malaysia will inevitably face both direct and indirect impact from the ongoing geopolitical conflict in the Middle East. ""Higher energy prices, supply chain disruptions, and heightened uncertainty are expected to weigh on the external environment,"" he said.

Headline inflation is projected to average 1.5% to 2.5% in 2026 as inflation is expected to edge higher due to elevated global energy and other commodity prices, broadly in line with expectations.

However, Abdul Ghaffour reiterated the economy is expected to remain resilient in 2026 with growth expected to come in within the 4-5% range, supported by steady domestic demand and continued expansion in our export performance.

READ ALSO: Malaysia's economy to grow 4-5% in 2026 backed by domestic resilience

According to him, resilient domestic demand will provide a strong buffer against external headwinds.

Household spending will be underpinned by firm labour market conditions and continuous policy support, while investment activity will be driven by the continued progress of multi-year projects in both the private and public sectors, as well as the ongoing implementation of national master plans.","KUALA LUMPUR: Malaysia's gross domestic product (GDP) grew at a slightly faster-than-anticipated rate of 5.4% in the first quarter of 2026, as economic growth moderated from 6.2% in the preceding quarter last year.
Advance estimates had pegged the growth rate at 5.3%, with analysts anticipating the normalisation of growth following strong year-end expansion in 2025, particularly in construction and services.
“Malaysia’s economy continued to expand in the first quarter of 2026, reflecting underlying resilience and stable growth conditions amid a challenging global environment.
According to the central bank, the higher headline inflation reflected some initial cost pass-through of higher global cost pressures, partly due to the conflict in the Middle East.
READ ALSO: Malaysia's economy to grow 4-5% in 2026 backed by domestic resilienceAccording to him, resilient domestic demand will provide a strong buffer against external headwinds.","['higher', 'inflation', 'malaysias', '1q', '2026', 'economy', 'global', 'expected', 'strong', '54', 'domestic', 'quarter', 'gdp', 'comes', 'growth']"
First-quarter GDP expected to hold steady,https://www.thestar.com.my/business/business-news/2026/05/15/first-quarter-gdp-expected-to-hold-steady,"Malaysia's first quarter of 2026 (1Q26) economic growth is expected to come broadly in line with earlier estimates, with economists pointing to resilient domestic demand even as external risks remain elevated ahead of the official release today.",2026-05-14T16:00:00Z,The Star,"PETALING JAYA: Malaysia’s first quarter of 2026 (1Q26) economic growth is expected to come broadly in line with earlier estimates, with economists pointing to resilient domestic demand even as external risks remain elevated ahead of the official release today.

Hong Leong Investment Bank (HLIB) Research expects 1Q26 gross domestic product (GDP) growth to come in at 5.4%, slightly above the Statistics Department’s advance estimate and consensus median forecast of 5.3%.

“Growth is expected to be anchored by sustained, albeit cooling, expansion across most sectors – services, manufacturing, agriculture and construction,” the research house noted in a GDP preview report.

On the demand side, HLIB Research said domestic demand is anticipated to be the primary growth engine, alongside a positive net export contribution propelled by stronger export growth.

Still, with ongoing uncertainties, the research house kept its GDP growth forecast for 2026 unchanged at 4.5% at this juncture, within Bank Negara Malaysia’s target range of 4% to 5%.

“While risks from potential global energy supply disruptions persist, we remain cautiously constructive on Malaysia’s economic resilience, underpinned by its status as a net exporter of oil and gas, trade relationships with other major oil producers, exposure to the ongoing global tech upcycle and supportive fiscal measures.”

The World Bank yesterday projected Malaysia’s economy to grow at 4.4% this year, with domestic demand continuing to anchor activity.

However, World Bank division director for Brunei, Malaysia and the Philippines Zafer Mustafaoglu said the near-term outlook is subject to considerable uncertainty.

“Risks are tilted to the downside. Geopolitical conflict and trade tensions, weaker global growth, financial market volatility, and policy uncertainty in major economies could all weigh on trade and confidence,” he said during his welcoming speech at the launch of the 32nd Malaysia Economic Monitor publication.

“As a highly open economy, Malaysia remains exposed – especially through trade and financial channels.”

He added that while Malaysia enters the period from a position of strength, the external headwinds reinforce the need for continued resilience-building.

“These headwinds are also a call to act – decisively. It is a reminder to keep strengthening resilience. Accelerate fiscal reforms to rebuild buffers. Ensure targeted support reaches Malaysians who need it most – especially where spatial disparities persist. And even amid immediate pressures, stay focused on the foundations for long term growth.”

Meanwhile, Economy Minister Akmal Nasrullah Mohd Nasir said 1Q26 economic growth is expected to meet the advance estimate of 5.3%, if not better.

“Although I am personally inclined to tone things down in the context of the current crisis, I expect the 1Q26 growth will not differ much from our projection and may even be better than the previous estimate,” he told Bernama.

He said the economy is forecast to grow between 4% and 5% in 2026, with inflation to remain “manageable” at 1.5% to 2.5%.","Hong Leong Investment Bank (HLIB) Research expects 1Q26 gross domestic product (GDP) growth to come in at 5.4%, slightly above the Statistics Department’s advance estimate and consensus median forecast of 5.3%.
“Growth is expected to be anchored by sustained, albeit cooling, expansion across most sectors – services, manufacturing, agriculture and construction,” the research house noted in a GDP preview report.
On the demand side, HLIB Research said domestic demand is anticipated to be the primary growth engine, alongside a positive net export contribution propelled by stronger export growth.
Still, with ongoing uncertainties, the research house kept its GDP growth forecast for 2026 unchanged at 4.5% at this juncture, within Bank Negara Malaysia’s target range of 4% to 5%.
And even amid immediate pressures, stay focused on the foundations for long term growth.”Meanwhile, Economy Minister Akmal Nasrullah Mohd Nasir said 1Q26 economic growth is expected to meet the advance estimate of 5.3%, if not better.","['malaysia', 'malaysias', 'steady', 'economy', 'demand', 'bank', 'expected', 'economic', 'hold', 'trade', 'research', 'domestic', 'gdp', 'growth', 'firstquarter']"
World Bank projects Malaysia's economy to grow 4.4% in 2026 amid global risks,https://www.thestar.com.my/business/business-news/2026/05/14/world-bank-projects-malaysia039s-economy-to-grow-44-in-2026-amid-global-risks,"KUALA LUMPUR: The World Bank projects Malaysia's economy to record solid growth of 4.4 per cent this year, with domestic demand continuing to anchor activity.",2026-05-14T06:50:00Z,The Star,"KUALA LUMPUR: The World Bank projects Malaysia’s economy to record solid growth of 4.4 per cent this year, with domestic demand continuing to anchor activity.

World Bank division director for the Philippines, Malaysia and Brunei Zafer Mustafaoglu said, however, the near-term outlook is subject to considerable uncertainty as risks are tilted to the downside.

""Geopolitical conflict and trade tensions, weaker global growth, financial market volatility, and

policy uncertainty in major economies could all weigh on trade and confidence,"" he said in his welcoming address at the launch of the April 2026 Malaysia Economic Monitor here, today.

He said that as a highly open economy, Malaysia remains exposed especially through trade and financial channels.

Malaysia’s growth outperformed expectations in the second half of 2025 even in a profoundly uncertain global environment, he noted.

""That lifted full-year growth to a robust 5.2 per cent, driven by strong domestic demand and export performance. This remarkable outcome reflects the economy’s underlying strength and resilience,"" he added.

At the same time, Mustafaoglu highlighted that Malaysia is facing an important challenge: while employment remains strong, productivity growth is modest.

""The result is underemployment, with many graduates in roles that do not fully utilise their skills.

This is not only a labour market issue but the underutilisation of human capital is a business dynamism issue.

""When the business environment is hampered by insufficient market contestability, uncompetitive regulations and cumbersome approval processes, uneven access to finance, and slow insolvency processes,

business innovation is limited, weakening productivity and wage growth,"" he added.

He also said that Malaysia’s jobs challenge is fundamentally a productivity challenge and if productivity growth does not increase, wages cannot rise sustainably.

""Addressing this challenge requires shifting from job quantity to job quality. The report highlights three priorities, namely unlocking a more dynamic business environment, to ignite innovation and channel finance to productivity, and to equip workers with the right skills and build future-ready human capital,” he said. - Bernama","KUALA LUMPUR: The World Bank projects Malaysia’s economy to record solid growth of 4.4 per cent this year, with domestic demand continuing to anchor activity.
He said that as a highly open economy, Malaysia remains exposed especially through trade and financial channels.
Malaysia’s growth outperformed expectations in the second half of 2025 even in a profoundly uncertain global environment, he noted.
At the same time, Mustafaoglu highlighted that Malaysia is facing an important challenge: while employment remains strong, productivity growth is modest.
He also said that Malaysia’s jobs challenge is fundamentally a productivity challenge and if productivity growth does not increase, wages cannot rise sustainably.","['malaysia', 'grow', 'world', 'risks', '44', 'uncertainty', 'economy', 'global', 'trade', 'environment', 'malaysias', 'business', 'bank', 'market', 'challenge', 'productivity', 'projects', 'strong', 'amid', 'growth']"
Malaysia’s unemployment rate holds steady at 2.9% in March 2026,https://www.thestar.com.my/news/nation/2026/05/12/malaysias-unemployment-rate-holds-steady-at-29-in-march-2026,"Malaysia's labour market remained stable in March 2026, with the unemployment rate unchanged at 2.9%, supported by continued expansion in employment and labour force participation, according to the Statistics Malaysia Department. Chief Statistician Datuk Seri Dr Mohd Uzir Mahidin said the positive economic outlook during the month enabled the country's labour market to sustain its steady growth momentum",2026-05-12T05:11:00Z,The Star,"PUTRAJAYA: Malaysia's labour market remained stable in March 2026, with the unemployment rate unchanged at 2.9%, supported by continued expansion in employment and labour force participation, according to the Statistics Malaysia Department.

Chief Statistician Datuk Seri Dr Mohd Uzir Mahidin said the positive economic outlook during the month enabled the country’s labour market to sustain its steady growth momentum.

""The labour force increased by 0.1% to 17.31 million persons in March 2026 from 17.30 million in February, while the labour force participation rate (LFPR) remained at 70.9%,” he said in a statement on Tuesday (May 12).

Mohd Uzir said the number of employed persons also edged up by 0.1 per cent to 16.80 million persons compared with 16.79 million recorded in the previous month.

The department's Statistics of the Labour Force, Malaysia, March and First Quarter 2026 also show that the number of unemployed persons rose slightly by 0.4% to 509,000 persons from 506,800 in February, leaving the unemployment rate unchanged at 2.9%.

The chief statistician said employees continued to make up the largest share of total employment at 75%, increasing marginally to 12.60 million persons in March from 12.59 million previously.

""On the same note, the number of own-account workers recorded a 0.3% rise to 3.14 million persons compared with 3.13 million in February,"" he added.

Mohd Uzir said the services sector remained the main contributor to employment growth, particularly in accommodation and food and beverage services, information and communication activities, as well as transportation and storage activities.

""The manufacturing, construction and agriculture sectors also recorded increases in employment, while the mining and quarrying sector saw a slight decline,"" he added.

On unemployment, Mohd Uzir said actively unemployed persons, defined as those available for work and actively seeking jobs, accounted for 79.7% of total unemployed persons. This category increased by 0.3% to 405,800 persons in March from 404,700 in February.

At the state level, Mohd Uzir said the Federal Territory of Putrajaya recorded the lowest unemployment rate at 1.3%, followed by Pahang at 1.9%, while Selangor and Melaka each posted 2%.

He said Putrajaya also registered the highest LFPR at 79.2%, followed by Selangor at 78% and the Federal Territory of Kuala Lumpur at 76%.

Looking ahead, Mohd Uzir said Malaysia’s labour market is expected to remain stable, supported by strong domestic fundamentals and ongoing structural transformation.

""However, growth is likely to be more moderate and increasingly shaped by external developments, particularly the trajectory of the global energy crisis and geopolitical conditions.

""As such, both businesses and the workforce will need to remain agile in navigating a more dynamic and uncertain economic environment,"" he said. - Bernama","PUTRAJAYA: Malaysia's labour market remained stable in March 2026, with the unemployment rate unchanged at 2.9%, supported by continued expansion in employment and labour force participation, according to the Statistics Malaysia Department.
""The labour force increased by 0.1% to 17.31 million persons in March 2026 from 17.30 million in February, while the labour force participation rate (LFPR) remained at 70.9%,” he said in a statement on Tuesday (May 12).
Mohd Uzir said the number of employed persons also edged up by 0.1 per cent to 16.80 million persons compared with 16.79 million recorded in the previous month.
On unemployment, Mohd Uzir said actively unemployed persons, defined as those available for work and actively seeking jobs, accounted for 79.7% of total unemployed persons.
Looking ahead, Mohd Uzir said Malaysia’s labour market is expected to remain stable, supported by strong domestic fundamentals and ongoing structural transformation.","['million', 'malaysias', 'persons', '2026', 'employment', 'steady', 'unemployment', '29', 'holds', 'rate', 'recorded', 'force', 'mohd', 'labour', 'uzir']"
Malaysia's inflation rises 1.9% in April 2026,https://www.thestar.com.my/business/business-news/2026/05/19/malaysia039s-inflation-rises-19-in-april-2026,"KUALA LUMPUR: Malaysia's inflation, as measured by the Consumer Price Index (CPI), rose 1.9 per cent year-on-year (y-o-y) in April 2026 to 136.9 from 134.3 in the same month last year, said the Department of Statistics Malaysia (DOSM).",2026-05-19T05:16:00Z,The Star,"KUALA LUMPUR: Malaysia’s inflation, as measured by the Consumer Price Index (CPI), rose 1.9 per cent year-on-year (y-o-y) in April 2026 to 136.9 from 134.3 in the same month last year, said the Department of Statistics Malaysia (DOSM).

In a statement today, chief statistician Datuk Seri Dr Mohd Uzir Mahidin said that inflation in April 2026 was mainly driven by the increase in the transport group (+4.1 per cent; March 2026: 1.6 per cent).

""In addition, Malaysia’s inflation was also driven by increases in alcoholic beverages and tobacco (2.8 per cent; March 2026: 2.7 per cent); information and communication (2.0 per cent; March 2026: 1.4 per cent); food and beverages (1.2 per cent; March 2026: 1.1 per cent) and furnishings, household equipment and routine household maintenance (0.4 per cent; March 2026: 0.1 per cent).

He said that about 63.5 per cent of items (364 out of 573) recorded price increases, of which 356 items registered an increase of less than or equal to 10 per cent, while only eight items recorded increases of more than 10 per cent in April 2026.

""Prices of the remaining 165 items (28.8 per cent) had declined and 44 items remained unchanged,” he said.

Mohd Uzir said that housing, water, electricity, gas and other fuels group increased to 1.1 per cent in April 2026 (March 2026: 1.2 per cent).

""This was driven by the subgroup of maintenance, repair and security of the dwelling, which eased to 2.3 per cent (March 2026: 3.3 per cent),” he said.

He said that the average price of unleaded RON97 in April 2026 increased to RM5.06 per litre (March 2026: RM4.03 per litre).

The average price for diesel in Peninsular Malaysia jumped to RM5.92 per litre (March 2026: RM4.12 per litre), and the average price of diesel for Sabah, Sarawak and Wilayah Persekutuan Labuan remained at RM2.15 per litre.

""Meanwhile, the average market price of unleaded RON95 increased to RM4.00 per litre (March 2026: RM3.16 per litre),” he said.

Mohd Uzir also said that in comparison to inflation in other selected countries, inflation in Malaysia in April 2026 (1.9 per cent) was lower than inflation in the Philippines (7.2 per cent), Vietnam (5.5 per cent), Thailand (2.9 per cent), the Republic of Korea (2.6 per cent) and Indonesia (2.4 per cent). - Bernama","In a statement today, chief statistician Datuk Seri Dr Mohd Uzir Mahidin said that inflation in April 2026 was mainly driven by the increase in the transport group (+4.1 per cent; March 2026: 1.6 per cent).
""In addition, Malaysia’s inflation was also driven by increases in alcoholic beverages and tobacco (2.8 per cent; March 2026: 2.7 per cent); information and communication (2.0 per cent; March 2026: 1.4 per cent); food and beverages (1.2 per cent; March 2026: 1.1 per cent) and furnishings, household equipment and routine household maintenance (0.4 per cent; March 2026: 0.1 per cent).
Mohd Uzir said that housing, water, electricity, gas and other fuels group increased to 1.1 per cent in April 2026 (March 2026: 1.2 per cent).
He said that the average price of unleaded RON97 in April 2026 increased to RM5.06 per litre (March 2026: RM4.03 per litre).
""Meanwhile, the average market price of unleaded RON95 increased to RM4.00 per litre (March 2026: RM3.16 per litre),” he said.","['malaysia', 'rises', 'inflation', 'malaysias', '2026', 'items', 'litre', '19', 'price', 'cent', 'average', 'increases', 'uzir']"
