title,url,description,publishedAt,source,text,summary,keywords
Ringgit continues growth trajectory after OPR maintained at 2.75%,https://www.thestar.com.my/business/business-news/2026/05/07/ringgit-continues-growth-trajectory-after-opr-maintained-at-275,"KUALA LUMPUR: The ringgit extended its gains today, closing firmer against major currencies and most regional peers following Bank Negara Malaysia's (BNM) move to maintain the Overnight Policy Rate (OPR) at 2.75 per cent.",2026-05-07T11:00:00Z,The Star,"KUALA LUMPUR: The ringgit extended its gains today, closing firmer against major currencies and most regional peers following Bank Negara Malaysia’s (BNM) move to maintain the Overnight Policy Rate (OPR) at 2.75 per cent.

The central bank, in a statement issued after its Monetary Policy Committee meeting today, said that at the current OPR level, the monetary policy stance is appropriate and consistent with the outlook for continued price stability and sustainable economic growth.

At 6 pm, the ringgit also rose against the US dollar to 3.9070/9115 from 3.9230/9275 at Wednesday’s close.

Bank Muamalat Malaysia Bhd chief economist Mohd Afzanizam Abdul Rashid said BNM’s decision to keep the OPR unchanged had been mostly anticipated by economists.

The attention shifts to BNM’s accompanying statement, he said, noting that it has become more dovish in its economic assessment.

""The central bank has become wary about the impact of the war on Iran on global crude oil prices and how it will shape the global growth trajectory going forward.

""In some sense, BNM is taking a pragmatic approach as its focus is on growth, since risk of higher inflation is very much due to the upward adjustment in cost rather than strong demand. Such pragmatism may have contributed to the appreciation of the ringgit,” he told Bernama.

Mohd Afzanizam also said the potential de-escalation in the United States-Iran war plays an important role in driving risk appetite among the traders.

Meanwhile, SPI Asset Management managing partner Stephen Innes said the ringgit continues to show resilience as the financial markets increasingly priced in a lower probability of further escalation in West Asia, which has helped restore confidence across regional currencies and broader emerging market assets.

He said the potential agreement between Washington and Tehran to end the conflict has reduced some of the geopolitical risk premium that had built up across global markets during the height of the conflict.

""The sharp pullback in crude oil prices has also become a particularly important tailwind for the ringgit and much of Asia’s importer-heavy economies.

""The improving backdrop has also helped support broader risk appetite, with investors rotating back into Asian assets as fears of a global recession begin to ease,” he said.

Furthermore, Innes said, markets are viewing the West Asia conflict as a temporary disruption rather than the beginning of a prolonged energy crisis, and that shift in sentiment has provided renewed support for regional currencies including the ringgit.

At the close, the ringgit traded higher against a basket of major currencies.

It strengthened versus the Japanese yen to 2.4982/5013 from 2.5159/5191 at Wednesday’s close, rose against the British pound to 5.3202/3263 from 5.3443/3504 yesterday, and edged up vis-a-vis the euro to 4.5978/6031 from 4.6189/6242 previously.

The local currency was mostly higher against regional peers.

It gained against the Singapore dollar to 3.0861/0901 from 3.0946/0986 at yesterday’s close, advanced versus the Thai baht to 12.1486/1687 from 12.1866/2074 previously, and inched up vis-a-vis the Indonesian rupiah to 225.4/225.7 from 225.6/225.9.

However, the ringgit eased against the Philippine peso to 6.46/6.48 from 6.39/6.41 at the previous close. - Bernama","KUALA LUMPUR: The ringgit extended its gains today, closing firmer against major currencies and most regional peers following Bank Negara Malaysia’s (BNM) move to maintain the Overnight Policy Rate (OPR) at 2.75 per cent.
At 6 pm, the ringgit also rose against the US dollar to 3.9070/9115 from 3.9230/9275 at Wednesday’s close.
Bank Muamalat Malaysia Bhd chief economist Mohd Afzanizam Abdul Rashid said BNM’s decision to keep the OPR unchanged had been mostly anticipated by economists.
At the close, the ringgit traded higher against a basket of major currencies.
However, the ringgit eased against the Philippine peso to 6.46/6.48 from 6.39/6.41 at the previous close.","['higher', 'regional', 'risk', 'policy', 'global', 'maintained', 'ringgit', 'opr', 'continues', 'trajectory', 'close', 'currencies', '275', 'markets', 'growth']"
Bursa Malaysia extends gains for fifth day; ringgit hits seven-week high,https://www.thestar.com.my/business/business-news/2026/05/07/bursa-malaysia-extends-gains-for-fifth-day-ringgit-hits-seven-week-high,"KUALA LUMPUR: Bursa Malaysia extended its gains for a fifth straight session on Thursday after Bank Negara kept its benchmark interest rate unchanged at 2.75%, in line with market expectations.",2026-05-07T09:25:00Z,The Star,"KUALA LUMPUR: Bursa Malaysia extended its gains for a fifth straight session on Thursday after Bank Negara kept its benchmark interest rate unchanged at 2.75%, in line with market expectations.

Market optimism was also boosted by positive regional sentiment amid continued enthusiasm surrounding artificial intelligence (AI)-related stocks.

At 5pm, the FBM KLCI rose 1.98 points, or 0.11%, to close at 1,758.85 after hitting an intraday high of 1,768.46 and a low of 1,758.42.

There were 660 gainers, 583 losers and 593 counters traded unchanged on the Bursa Malaysia. Turnover stood at 3.8 billion shares valued at RM4.25bil.

Dealers said sentiment was supported by Bank Negara’s decision to maintain the OPR at 2.75%, which provided clarity on the domestic monetary policy outlook.

They added that continued optimism over AI-related stocks and stronger regional markets also lifted investor appetite across Asian equities.

Among the gainers on Bursa Malaysia were Nestle, which surged RM3.20 to RM104.10, F&N, which rose 92 sen to RM30.02, Allianz, which climbed 62 sen to RM21.42, and UMS Integration, which gained 54 sen to RM7.37.

On the losing side, PETRONAS Chemicals fell 59 sen to RM5.28, MISC slid 31 sen to RM8.37, Gas Malaysia dropped 20 sen to RM5.30, while Malaysian Pacific Industries declined 18 sen to RM41.22.

On the forex market, the ringgit rose 0.41% to 3.9093 against the US dollar, its highest level in seven weeks. Year-to-date, the local currency has strengthened 3.88% against the greenback.

The ringgit also gained against the Singapore dollar, rising 0.31% to 3.0870, its highest level in about six weeks.

According to Bursa Malaysia data, foreign investors and local institutions were net buyers on Wednesday, purchasing RM123mil and RM209mil worth of equities, respectively, while retail investors were net sellers at RM332mil.

Around the region, MSCI’s Asia ex-Japan stock index rose 1.76%, with most regional markets ending higher.

China’s blue-chip CSI300 Index and the Shanghai Composite Index both gained 0.48% to close at 4,900.51 and 4,180.09, respectively.

Hong Kong’s benchmark Hang Seng Index climbed 1.57% to 26,626.28.

Japan’s Nikkei 225 Index surged 5.58% — its biggest gain in more than a year — to close at a record high of 62,833.84, while South Korea’s Kospi advanced 1.43% to 7,490.05.","KUALA LUMPUR: Bursa Malaysia extended its gains for a fifth straight session on Thursday after Bank Negara kept its benchmark interest rate unchanged at 2.75%, in line with market expectations.
There were 660 gainers, 583 losers and 593 counters traded unchanged on the Bursa Malaysia.
According to Bursa Malaysia data, foreign investors and local institutions were net buyers on Wednesday, purchasing RM123mil and RM209mil worth of equities, respectively, while retail investors were net sellers at RM332mil.
Around the region, MSCI’s Asia ex-Japan stock index rose 1.76%, with most regional markets ending higher.
Japan’s Nikkei 225 Index surged 5.58% — its biggest gain in more than a year — to close at a record high of 62,833.84, while South Korea’s Kospi advanced 1.43% to 7,490.05.","['malaysia', 'unchanged', 'regional', 'high', 'gained', 'surged', 'gains', 'extends', 'hits', 'day', 'ringgit', 'bursa', 'close', 'rose', 'index', 'sen', 'fifth', 'sevenweek']"
Ringgit opens higher against US$ ahead of Bank Negara policy meeting,https://www.thestar.com.my/business/business-news/2026/05/06/ringgit-opens-higher-against-us-ahead-of-bank-negara-policy-meeting,"KUALA LUMPUR: The ringgit opened higher against the US dollar on Wednesday ahead of Bank Negara Malaysia (BNM)'s Monetary Policy Committee (MPC) meeting tomorrow, where policymakers will assess inflation and growth, key factors shaping the outlook for the Overnight Policy Rate.",2026-05-06T01:27:00Z,The Star,"KUALA LUMPUR: The ringgit opened higher against the US dollar on Wednesday ahead of Bank Negara Malaysia (BNM)’s Monetary Policy Committee (MPC) meeting tomorrow, where policymakers will assess inflation and growth, key factors shaping the outlook for the Overnight Policy Rate.

At 8 am, the domestic unit traded at 3.9530/9635 against the greenback, compared with 3.9600/9635 at Tuesday’s close.

Bank Muamalat Malaysia Bhd chief economist Dr Mohd Afzanizam Abdul Rashid said markets would also focus on the MPC meeting, particularly the accompanying statement.

""The outlook for the second quarter remains intact, although markets are closely watching the impact of escalating tensions in West Asia,” he told Bernama.

According to the bank’s research note, the impact of the conflict in Iran is beginning to be reflected in Malaysia’s inflation. The Consumer Price Index (CPI), which measures overall price levels, rose 1.7 per cent year-on-year to 136.4 points in March 2026, compared with 1.4 per cent in February.

Mohd Afzanizam added that concerns over the West Asia crisis continued to weigh on market sentiment.

""Yesterday, the ringgit weakened 0.15 per cent to RM3.9618 against the US dollar. In light of the latest developments, it is likely to appreciate, although gains are expected to be measured,” he said.

At the open, the ringgit traded mixed against a basket of major currencies.

It strengthened against the Japanese yen to 2.5065/5133 from 2.5138/5163 at Tuesday’s close, but weakened against the euro to 4.6305/6428 from 4.6288/6329, and edged lower versus the British pound to 5.3626/3769 from 5.3622/3670.

The local currency was mostly weaker against regional peers.

It rose against the Indonesian rupiah to 226.8/227.5 from 227.2/227.5, but fell against the Singapore dollar to 3.1021/1108 from 3.1013/1042, weakened versus the Thai baht to 12.1803/2187 from 12.1064/1223, and eased against the Philippine peso to 6.4240/4400 from 6.4300/4400 previously. - Bernama","KUALA LUMPUR: The ringgit opened higher against the US dollar on Wednesday ahead of Bank Negara Malaysia (BNM)’s Monetary Policy Committee (MPC) meeting tomorrow, where policymakers will assess inflation and growth, key factors shaping the outlook for the Overnight Policy Rate.
At 8 am, the domestic unit traded at 3.9530/9635 against the greenback, compared with 3.9600/9635 at Tuesday’s close.
Bank Muamalat Malaysia Bhd chief economist Dr Mohd Afzanizam Abdul Rashid said markets would also focus on the MPC meeting, particularly the accompanying statement.
""Yesterday, the ringgit weakened 0.15 per cent to RM3.9618 against the US dollar.
At the open, the ringgit traded mixed against a basket of major currencies.","['higher', 'policy', 'bank', 'meeting', 'ahead', 'dollar', 'west', 'traded', 'ringgit', 'opens', 'weakened', 'price', 'cent', 'tuesdays', 'rose', 'versus', 'negara']"
"Ringgit ends mostly firmer against major, regional currencies ahead of MPC meeting",https://www.thestar.com.my/business/business-news/2026/05/05/ringgit-ends-mostly-firmer-against-major-regional-currencies-ahead-of-mpc-meeting,KUALA LUMPUR: The ringgit ended firmly against most major currencies and regional peers ahead of Bank Negara Malaysia's (BNM) Monetary Policy Committee (MPC) meeting as its decision is expected to play a critical role in setting the market tone going forward.,2026-05-05T10:57:00Z,The Star,"KUALA LUMPUR: The ringgit ended firmly against most major currencies and regional peers ahead of Bank Negara Malaysia’s (BNM) Monetary Policy Committee (MPC) meeting as its decision is expected to play a critical role in setting the market tone going forward.

However, it eased against the US dollar at 6pm today to 3.9600/9635 from 3.9540/9575 on Monday’s close.

According to research firms, BNM is anticipated to maintain the Overnight Policy Rate (OPR) at 2.75 per cent at its MPC meeting on Thursday.

This follows Malaysia’s advanced first-quarter gross domestic product growth forecast of 5.3 per cent, which showed that the country’s economy is resilient despite the unsteady global situation.

Bank Muamalat Malaysia Bhd chief economist Mohd Afzanizam Abdul Rashid expects the local note to be trading at a narrow range in the near term following the MPC meeting on May 7.

""We view market sentiment will continue to remain cautious as investors were perplexed on whether global central banks' benchmark interest rate should be raised or cut.

""There are certain jurisdictions, such as in Australia, the Philippines and Singapore, which have tightened their monetary stance. At the same time, there is also a valid concern on global growth prospects, which may necessitate easing monetary policy stance,” he told Bernama.

SPI Asset Management managing partner Stephen Innes said continued equity inflows into Malaysia’s technology and semiconductor sectors have boosted local assets, supporting the ringgit.

He said investors’ appetite tied to artificial intelligence (AI) themes has provided an underlying buffer to local assets.

""However, renewed escalation in the United States-Iran conflict has weakened risk sentiment and strengthened the US dollar, while briefly pushed Brent crude oil prices toward US$114 per barrel.

""Overall, the ringgit remains influenced by external factors, including oil price volatility and US dollar strength, but (ringgit) continues to show resilience due to supportive domestic equity flows,” he told Bernama.

At the close, the ringgit traded mostly higher against a basket of major currencies.

It edged up against the Japanese yen to 2.5138/5163 from 2.5186/5210 at Monday’s close, rose vis-a-vis the euro to 4.6288/6329 from 4.6329/6370 previously but inched down versus the British pound to 5.3622/3670 from 5.3612/3660 yesterday.

The local currency was also mostly higher against regional peers.

It inched up against the Singapore dollar to 3.1013/1042 from 3.1019/1049 at Monday’s close, appreciated versus the Thai baht to 12.1064/1223 from 12.1460/1631, gained vis-a-vis the Indonesian rupiah to 227.2/227.5 from 227.3/227.6 yesterday, but eased against the Philippine peso to 6.43/6.44 from 6.42/6.43 previously. - Bernama","KUALA LUMPUR: The ringgit ended firmly against most major currencies and regional peers ahead of Bank Negara Malaysia’s (BNM) Monetary Policy Committee (MPC) meeting as its decision is expected to play a critical role in setting the market tone going forward.
According to research firms, BNM is anticipated to maintain the Overnight Policy Rate (OPR) at 2.75 per cent at its MPC meeting on Thursday.
Bank Muamalat Malaysia Bhd chief economist Mohd Afzanizam Abdul Rashid expects the local note to be trading at a narrow range in the near term following the MPC meeting on May 7.
At the same time, there is also a valid concern on global growth prospects, which may necessitate easing monetary policy stance,” he told Bernama.
At the close, the ringgit traded mostly higher against a basket of major currencies.","['mpc', 'regional', 'malaysias', 'policy', 'dollar', 'meeting', 'major', 'firmer', 'ahead', 'local', 'ringgit', 'monetary', 'global', 'currencies', 'mondays', 'ends']"
Ringgit steady against US$ ahead of MPC decision,https://www.thestar.com.my/business/business-news/2026/05/05/ringgit-steady-against-us-ahead-of-mpc-decision,"KUALA LUMPUR: The ringgit opened nearly unchanged against the US dollar from yesterday's close as markets await the latest decision by Bank Negara Malaysia's (BNM) Monetary Policy Committee (MPC), scheduled for May 7.",2026-05-05T01:20:00Z,The Star,"KUALA LUMPUR: The ringgit opened nearly unchanged against the US dollar from yesterday’s close as markets await the latest decision by Bank Negara Malaysia’s (BNM) Monetary Policy Committee (MPC), scheduled for May 7.

At 8 am, the domestic unit traded at 3.9540/9590 against the greenback compared with 3.9540/9575 at yesterday’s close.

Bank Muamalat Malaysia Bhd chief economist Dr Mohd Afzanizam Abdul Rashid said while the market adopted a wait-and-see approach ahead of the MPC meeting, the exchange of fire in the Persian Gulf erupted between United States (US) and Iranian forces, potentially compromising the ceasefire.

""Escalation in West Asia has consequently seen global oil benchmark WTI and Brent crude prices jumped 4.39 per cent and 5.80 per cent to US$106.42 per barrel and US$114.44 per barrel, respectively.

""Today, the ringgit is expected to depreciate against the US dollar in light of the latest developments. Clearly, market sentiment will continue to revolve around the war in West Asia and the ensuing oil supply shock, which would exert upward pressure on inflation,” he told Bernama.

Meanwhile, the ringgit traded higher against a basket of major currencies.

It rose against the Japanese yen to 2.5151/5184 from 2.5186/5210 at yesterday’s close, appreciated versus the British pound to 5.3498/3565 from 5.3612/3660, and strengthened vis-a-vis the euro to 4.6230/6289 from 4.6329/6370 previously.

The local currency was firmer against regional peers.

It advanced against the Singapore dollar to 3.0963/1005 from 3.1019/1049 at Monday’s close, gained versus the Thai baht to 12.0740/0963 from 12.1460/1631, edged up versus the Indonesian rupiah to 227.3/227.6 from 227.3/227.6, but was flat vis-a-vis the Philippine peso at 6.42/6.43. - Bernama","KUALA LUMPUR: The ringgit opened nearly unchanged against the US dollar from yesterday’s close as markets await the latest decision by Bank Negara Malaysia’s (BNM) Monetary Policy Committee (MPC), scheduled for May 7.
At 8 am, the domestic unit traded at 3.9540/9590 against the greenback compared with 3.9540/9575 at yesterday’s close.
""Today, the ringgit is expected to depreciate against the US dollar in light of the latest developments.
Meanwhile, the ringgit traded higher against a basket of major currencies.
It rose against the Japanese yen to 2.5151/5184 from 2.5186/5210 at yesterday’s close, appreciated versus the British pound to 5.3498/3565 from 5.3612/3660, and strengthened vis-a-vis the euro to 4.6230/6289 from 4.6329/6370 previously.","['mpc', 'oil', 'steady', 'yesterdays', 'decision', 'ahead', 'dollar', 'west', 'ringgit', 'traded', 'close', 'visavis', 'versus']"
"Ringgit opens higher against greenback, major currencies",https://www.thestar.com.my/business/business-news/2026/05/22/ringgit-opens-higher-against-greenback-major-currencies,"KUALA LUMPUR: The ringgit opened firmer against the US dollar and major currencies on Friday, supported by easing geopolitical tensions in West Asia and Malaysia's improving macroeconomic outlook.",2026-05-22T01:22:00Z,The Star,"KUALA LUMPUR: The ringgit opened firmer against the US dollar and major currencies on Friday, supported by easing geopolitical tensions in West Asia and Malaysia’s improving macroeconomic outlook.

At 8 am, the local currency strengthened to 3.9550/9645 against the greenback from Thursday’s close of 3.9595/9630.

Bank Muamalat Malaysia Bhd chief economist Mohd Afzanizam Abdul Rashid said optimism that the United States (US) and Iran would soon reach an amicable resolution continues to build.

He said West Texas Intermediate (WTI) and Brent crude prices fell 1.49 per cent and 2.32 per cent to US$97.79 per barrel and US$102.58 per barrel, respectively.

""According to the Iranian news agency, Tehran is evaluating the proposal from the US, which has narrowed the gaps to some extent,” he told Bernama.

He also said the ringgit should remain in a better position amid Malaysia’s positive macroeconomic backdrop, particularly as the current account surplus rose to 3.0 per cent of gross domestic product (GDP) in the first quarter of 2026 from 0.5 per cent in the previous quarter.

""Apart from that, the government’s fiscal position continued to improve, with the fiscal deficit narrowing to RM17.1 billion or 3.3 per cent of GDP in the first quarter of 2026 from RM21.9 billion or 4.5 per cent of GDP in the corresponding period of 2025

""Hence, the ringgit is expected to remain well supported at around RM3.95 to RM3.96 against the US dollar today,” he said.

At the opening, the ringgit traded higher against a basket of major currencies.

The local currency appreciated against the British pound to 5.3120/3247 from 5.3220/3267 at Thursday’s close, strengthened against the euro to 4.5945/6056 from 4.6037/6078 previously, and rose against the Japanese yen to 2.4866/4928 from 2.4906/4929.

The ringgit also traded higher against regional currencies.

It strengthened against the Singapore dollar to 3.0949/1026 from 3.0967/0997 previously and appreciated against the Thai baht to 12.1286/1648 from 12.1304/1468.

The local note also improved against the Indonesian rupiah to 223.8/224.5 from 224.1/224.4 previously and appreciated against the Philippine peso to 6.42/6.44 from 6.43/6.44 previously. - Bernama","KUALA LUMPUR: The ringgit opened firmer against the US dollar and major currencies on Friday, supported by easing geopolitical tensions in West Asia and Malaysia’s improving macroeconomic outlook.
At 8 am, the local currency strengthened to 3.9550/9645 against the greenback from Thursday’s close of 3.9595/9630.
At the opening, the ringgit traded higher against a basket of major currencies.
The ringgit also traded higher against regional currencies.
It strengthened against the Singapore dollar to 3.0949/1026 from 3.0967/0997 previously and appreciated against the Thai baht to 12.1286/1648 from 12.1304/1468.","['higher', 'strengthened', 'dollar', 'major', 'local', 'west', 'traded', 'ringgit', 'opens', 'previously', 'cent', 'currencies', 'appreciated', 'gdp', 'greenback']"
"Ringgit closes higher against US dollar, regional peers",https://www.thestar.com.my/business/business-news/2026/05/21/ringgit-closes-higher-against-us-dollar-regional-peers,"KUALA LUMPUR: The ringgit closed higher against the US dollar today, supported by Malaysia's favourable domestic fundamentals.",2026-05-21T11:05:00Z,The Star,"KUALA LUMPUR: The ringgit closed higher against the US dollar today, supported by Malaysia’s favourable domestic fundamentals.

At 6 pm, the ringgit appreciated to 3.9595/9630 versus the greenback from 3.9675/9715 at Wednesday’s close.

Bank Muamalat Malaysia Bhd chief economist Dr Mohd Afzanizam Abdul Rashid said the ringgit should be in a better position as the country continues to record a current account surplus, while the government remains committed to reducing the fiscal deficit.

He said news on the possible finalisation of negotiations between the United States and Iran had resulted in lower crude oil prices, while the US Dollar Index (DXY) stabilised at around 99 points.

""However, some central banks remain under pressure to adjust interest rates to stem currency depreciation and contain inflationary pressure, especially in economies facing fiscal and current account deficits,” he told Bernama.

At the close, the ringgit traded mostly lower against a basket of major currencies.

It strengthened versus the Japanese yen to 2.4906/4929 from 2.4942/4969 at Wednesday’s close, but slipped against the euro to 4.6037/6078 from 4.5975/6022 yesterday, and slid against the British pound to 5.3220/3267 from 5.3089/3143 previously.

At the same time, the local currency traded mostly higher against regional peers.

It appreciated against the Singapore dollar to 3.0967/0997 from 3.0969/1003 at the close on Wednesday, rose against the Thai baht to 12.1304/1468 from 12.1341/1516 yesterday, edged up against the Indonesian rupiah to 224.1/224.4 from 224.7/225.0 previously, and remained flat against the Philippine peso at 6.43/6.44. - Bernama","KUALA LUMPUR: The ringgit closed higher against the US dollar today, supported by Malaysia’s favourable domestic fundamentals.
At 6 pm, the ringgit appreciated to 3.9595/9630 versus the greenback from 3.9675/9715 at Wednesday’s close.
At the close, the ringgit traded mostly lower against a basket of major currencies.
It strengthened versus the Japanese yen to 2.4906/4929 from 2.4942/4969 at Wednesday’s close, but slipped against the euro to 4.6037/6078 from 4.5975/6022 yesterday, and slid against the British pound to 5.3220/3267 from 5.3089/3143 previously.
At the same time, the local currency traded mostly higher against regional peers.","['higher', 'regional', 'closes', 'yesterday', 'lower', 'dollar', 'traded', 'peers', 'ringgit', 'pressure', 'close', 'versus', 'wednesdays']"
