title,url,description,publishedAt,source,text,summary,keywords
Ringgit firmer against US dollar as stronger export performance lifts market sentiment,https://www.thestar.com.my/business/business-news/2026/05/20/ringgit-firmer-against-us-dollar-as-stronger-export-performance-lifts-market-sentiment,"KUALA LUMPUR: The ringgit firmed against the US dollar as market sentiment improved on the back of Malaysia's trade performance, which rose 28.6 per cent year-on-year (y-o-y) to a record RM336.73 billion in April 2026.",2026-05-20T10:59:00Z,The Star,"KUALA LUMPUR: The ringgit firmed against the US dollar as market sentiment improved on the back of Malaysia’s trade performance, which rose 28.6 per cent year-on-year (y-o-y) to a record RM336.73 billion in April 2026.

At 6 pm, the ringgit edged up to 3.9675/9715 versus the greenback from 3.9745/9785 at Tuesday’s close.

The Ministry of Investment, Trade and Industry (MITI) earlier reported that the higher export figures were driven mainly by strong exports of electrical and electronic (E&E) products.

Malaysia’s trade maintained strong momentum in April 2026 with exports and imports reaching record highs despite heightened global uncertainties, including geopolitical tensions in West Asia that led to higher logistics costs, supply chain disruptions and commodity price volatility.

MITI also said exports extended their growth momentum for the 10th consecutive month, surging 36.9 per cent to a record RM182.74 billion, surpassing the previous high of RM152.77 billion recorded in December 2025 by RM30 billion, while imports rose 20 per cent to RM153.99 billion.

Meanwhile, Bank Muamalat Malaysia Bhd chief economist Dr Mohd Afzanizam Abdul Rashid said the ringgit is firming against the US dollar as the situation in West Asia remained unresolved while geopolitical risks remained wobbly.

""The market is also concerned over the higher inflation rate globally following the blockade of the Strait of Hormuz and how the central bank would respond to cost-induced inflation. These have been the key factors driving market sentiments,” he added.

At the close, the ringgit traded higher against a basket of major currencies.

It strengthened versus the Japanese yen to 2.4942/4969 from 2.4980/5006 and appreciated against the euro to 4.5975/6022 from 4.6180/6226 at yesterday's close and gained against the British pound to 5.3089/3143 from 5.3282/3336 previously.

At the same time, the local currency traded mixed against regional peers, rising against the Singapore dollar to 3.0969/1003 from 3.1022/1055 at Tuesday’s close and rose against the Thai baht to 12.1341/1516 from 12.1719/1898.

The local currency was flat against the Philippine peso at 6.43/6.44 versus 6.43/6.45 on Tuesday and weakened against the Indonesian rupiah to 224.7/225.0 from 224.4/224.8 yesterday. - Bernama","KUALA LUMPUR: The ringgit firmed against the US dollar as market sentiment improved on the back of Malaysia’s trade performance, which rose 28.6 per cent year-on-year (y-o-y) to a record RM336.73 billion in April 2026.
At 6 pm, the ringgit edged up to 3.9675/9715 versus the greenback from 3.9745/9785 at Tuesday’s close.
The Ministry of Investment, Trade and Industry (MITI) earlier reported that the higher export figures were driven mainly by strong exports of electrical and electronic (E&E) products.
At the close, the ringgit traded higher against a basket of major currencies.
The local currency was flat against the Philippine peso at 6.43/6.44 versus 6.43/6.45 on Tuesday and weakened against the Indonesian rupiah to 224.7/225.0 from 224.4/224.8 yesterday.","['higher', 'export', 'dollar', 'billion', 'firmer', 'ringgit', 'stronger', 'sentiment', 'performance', 'lifts', 'market', 'trade', 'rose', 'versus', 'record', 'exports']"
"US proposes tariffs on goods from Malaysia, 59 other economies over forced labour failures",https://www.thestar.com.my/news/nation/2026/06/03/us-proposes-tariffs-on-goods-from-malaysia-59-other-economies-over-forced-labour-failures,KUALA LUMPUR: The Trump administration on Tuesday proposed imposing additional duties of 10 per cent or 12.5 per cent on imports from 60 economies after determining their failures to curb trade in goods made with forced labour are unreasonable and restrict US commerce.,2026-06-03T05:31:00Z,The Star,"KUALA LUMPUR: The Trump administration on Tuesday proposed imposing additional duties of 10 per cent or 12.5 per cent on imports from 60 economies after determining their failures to curb trade in goods made with forced labour are unreasonable and restrict US commerce.

The proposal from the US Trade Representative's (USTR) office is the latest finding from a Section 301 unfair trade practices investigation to be released as the Trump administration seeks to rebuild its emergency tariffs, which were struck down by a US Supreme Court decision in February.

The USTR said it determined that it would impose 10 per cent duties related to the forced labour investigation on imports from Canada, Ecuador, the European Union, Indonesia, Mexico, Pakistan, Argentina, Bangladesh, Cambodia, El Salvador, Guatemala, Indonesia, Malaysia, Taiwan and Britain.

The trade agency said it would impose additional duties of 12.5 per cent on the remaining 45 countries that it investigated.

""The failure of our most important trading partners to address the importation of goods made with forced labour is unacceptable,"" US Trade Representative Jamieson Greer said in a statement. ""This creates a dynamic where American workers are forced to compete globally on an unlevel playing field.""

The USTR said it also was proposing a textile mechanism that would allow for a certain volume of apparel and textile imports to enter the US at a reduced tariff rate, though the duties and volumes were not disclosed.

The announcement comes ahead of the July 24 expiration of a 10 per cent temporary tariff imposed by the Trump administration on February 20, the day the Supreme Court struck down US President Donald Trump's tariffs under the International Emergency Economic Powers Act.

On Monday, the USTR proposed a 25 per cent duty on many Brazilian goods as a result of a Section 301 investigation into the country's digital trade practices and preferential tariffs. The trade agency is also expected to soon unveil the findings of another major Section 301 probe into the buildup of excess industrial capacity in 16 trading partners, including China.

In the forced labour findings, the USTR said it would exempt from the tariffs a number of products, including energy, rare earths and certain other metals, beef, coffee, certain fruits and vegetables, pharmaceuticals, organic chemicals and aircraft parts.

The USTR said it would accept public comments on the proposed tariffs and other remedies through July 6, with a public hearing scheduled for July 7. - Reuters","The USTR said it determined that it would impose 10 per cent duties related to the forced labour investigation on imports from Canada, Ecuador, the European Union, Indonesia, Mexico, Pakistan, Argentina, Bangladesh, Cambodia, El Salvador, Guatemala, Indonesia, Malaysia, Taiwan and Britain.
""The failure of our most important trading partners to address the importation of goods made with forced labour is unacceptable,"" US Trade Representative Jamieson Greer said in a statement.
On Monday, the USTR proposed a 25 per cent duty on many Brazilian goods as a result of a Section 301 investigation into the country's digital trade practices and preferential tariffs.
In the forced labour findings, the USTR said it would exempt from the tariffs a number of products, including energy, rare earths and certain other metals, beef, coffee, certain fruits and vegetables, pharmaceuticals, organic chemicals and aircraft parts.
The USTR said it would accept public comments on the proposed tariffs and other remedies through July 6, with a public hearing scheduled for July 7.","['malaysia', 'economies', 'forced', 'tariffs', 'trump', 'proposes', 'failures', '59', 'cent', 'trade', 'duties', 'proposed', 'goods', 'ustr', 'labour', 'investigation']"
Malaysia to suspend imports of sea bass and five Thai shrimp species from June 1,https://www.thestar.com.my/aseanplus/aseanplus-news/2026/06/01/malaysia-to-suspend-imports-of-sea-bass-and-five-thai-shrimp-species-from-june-1,"BANGKOK: Thailand's seafood export market has been shaken after Malaysia announced strict new measures from Monday (June 1, 2026), affecting Thai sea bass and five shrimp species and raising the risk of domestic oversupply.",2026-06-01T06:47:00Z,The Star,"BANGKOK: Thailand’s seafood export market has been shaken after Malaysia announced strict new measures from Monday (June 1, 2026), affecting Thai sea bass and five shrimp species and raising the risk of domestic oversupply.

The Office of Commercial Affairs in Kuala Lumpur reported that Malaysia is preparing to enforce strict controls on seafood imports from Thailand from Monday.

The measures are described as a trade response and an upgrade of national food safety safeguards.

The seafood covered by the restrictions focuses on sea bass and five shrimp species: brown tiger prawn, banana prawn, whiteleg shrimp, giant tiger prawn and blue shrimp.

For the sea bass import measure, operators must attach a Certificate of Analysis to every import to confirm that the products meet the food safety standards of Malaysia’s Ministry of Health.

For the measure suspending shrimp imports, Malaysian authorities said it is being carried out as a reciprocal response because Thailand had previously imposed similar conditions on shrimp imports from Malaysia.

The import suspension will continue until Thai agencies submit complete responses to a food-safety standards questionnaire to Malaysian authorities, after which the measure will be reassessed.

Earlier, on Wednesday (May 13, 2026), the Fisheries Development Authority of Malaysia invited importers of sea bass and shrimp from Thailand, as well as representatives of relevant agencies, including the Department of Fisheries, the Ministry of Health and checkpoint agencies, to attend a meeting to explain the new guidelines so operators could prepare before the measures take effect.

The main aim of the tightened controls is to strengthen food safety and biosecurity, and to guarantee quality standards for imported fishery products in order to protect the interests of consumers and the domestic industry.

However, Malaysia’s Ministry of Agriculture and Food Security explained that all inspections and import suspensions at border checkpoints would be managed carefully to ensure they would not affect the supply of sea bass and shrimp for domestic consumption.

Domestic impact and oversupply concerns

The enforcement of the measures on Monday will affect Thailand’s seafood export supply chain in several dimensions.

In the short term, the sudden suspension of imports of the five main shrimp species will cause a direct loss of revenue from the Malaysian market if exports cannot proceed.

It could lead to domestic oversupply, which may put downward pressure on shrimp prices in Thailand, forcing farmers and exporters to urgently divert products to other alternative markets.

For sea bass exporters, the requirement to use a Certificate of Analysis will create hidden costs for Thai operators, including laboratory testing expenses and the time spent waiting for test results.

Operators advised to prepare

The office added that the measures would inevitably affect logistics costs and timelines, and urged Thai operators to prepare and adjust before Monday.

Sea bass exporters should urgently study Malaysia’s food-safety regulations and allow extra time to obtain a Certificate of Analysis (CoA) from recognised laboratories to prevent goods from being held up or spoiling because of delays in release at inspection checkpoints.

Exporters of all five shrimp species should temporarily suspend shipments of fresh and frozen products to Malaysia to prevent returns and accelerate distribution to alternative export markets or the domestic market to reduce the risk of oversupply.

Operators should also work closely with importers on the Malaysian side to update themselves on the latest guidelines and monitor progress on the Thai Department of Fisheries’ questionnaire response so they are ready to resume exports as soon as Malaysian authorities announce the lifting of the measures. - The Nation/ANN","BANGKOK: Thailand’s seafood export market has been shaken after Malaysia announced strict new measures from Monday (June 1, 2026), affecting Thai sea bass and five shrimp species and raising the risk of domestic oversupply.
The seafood covered by the restrictions focuses on sea bass and five shrimp species: brown tiger prawn, banana prawn, whiteleg shrimp, giant tiger prawn and blue shrimp.
For the sea bass import measure, operators must attach a Certificate of Analysis to every import to confirm that the products meet the food safety standards of Malaysia’s Ministry of Health.
For the measure suspending shrimp imports, Malaysian authorities said it is being carried out as a reciprocal response because Thailand had previously imposed similar conditions on shrimp imports from Malaysia.
In the short term, the sudden suspension of imports of the five main shrimp species will cause a direct loss of revenue from the Malaysian market if exports cannot proceed.","['malaysia', 'malaysian', 'sea', 'species', 'imports', 'shrimp', 'measures', 'suspend', 'bass', 'thailand', 'domestic', 'thai', 'seafood']"
B15 implementation in peninsular Malaysia will not affect palm oil exports,https://www.thestar.com.my/business/business-news/2026/05/25/b15-implementation-in-peninsular-malaysia-will-not-affect-palm-oil-exports,PUTRAJAYA: The B15 biodiesel implementation in Peninsular Malaysia starting June 1 is set to strengthen the country's energy security without affecting palm oil export volume while also helping to support the local palm oil industry and accelerate the national green agenda.,2026-05-25T08:24:00Z,The Star,"PUTRAJAYA: The B15 biodiesel implementation in Peninsular Malaysia starting June 1 is set to strengthen the country’s energy security without affecting palm oil export volume while also helping to support the local palm oil industry and accelerate the national green agenda.

Plantation and Commodities Minister Datuk Seri Dr Noraini Ahmad said the increase in the biodiesel blend from B10 to B15 (15 per cent palm oil-based biodiesel) has been carefully planned after taking into account the industry’s readiness, supply situation, and existing infrastructure.

She said the government had conducted a detailed analysis regarding the implementation, including the country’s palm oil supply capacity, to ensure that exports of the commodity would not be affected.

""We produce about 20 million metric tonnes of palm oil annually and export around 16 million metric tonnes. This means there is a surplus of about four million metric tonnes for domestic use.

""The implementation of B15 only requires about 0.8 million metric tonnes out of that amount, so it will not disrupt the country’s export volume,” she said during a media briefing on the B15 biodiesel implementation here today.

Noraini said B15 was selected as the best blending rate at present following engagement sessions with industry players, who felt the rate could be implemented without requiring major upgrades to existing facilities.

""We see B15 as the appropriate rate that can be carried out in the near term without requiring major changes to existing facilities,” she said.

Noraini said the B15 implementation is also expected to help boost demand for local palm oil while reducing the country’s dependence on imported fossil-based diesel.

On April 14, Economy Minister Akmal Nasrullah Mohd Nasir said the government has agreed to increase the biodiesel blend rate from B10 to B15, beginning with B12, in order to sustain the country’s diesel supply following the crisis in West Asia.

The move was taken to avoid overdependence on imported fossil fuels and external markets as well as to implement economic restructuring through an accelerated transition to renewable energy.

Touching on the expansion of B20 biodiesel usage, Noraini said several areas, including Sarawak, Labuan, Langkawi, and Bintulu, have already implemented B20.

She said the government has also approved an allocation of RM42 million for the first phase of facilities upgrade towards the implementation of B20 in Sarawak.

""For the second phase, the ministry is requesting an additional allocation of about RM56 million to upgrade distribution terminals, particularly in the Klang Valley Distribution Terminal (KVDT) area,” she said.

The National Biodiesel Programme, introduced in 2011 through the implementation of B5 for the transportation sector, was expanded with the introduction of B7 in 2014, followed by the phased rollout of the B10 and B20 mandates between 2019 and 2020.

The B10 biodiesel mandate for the transportation sector involves a composition of 10 per cent palm oil-based methyl ester (PME) and 90 per cent petroleum diesel, while B20 biodiesel contains 20 per cent PME and 80 per cent petroleum diesel.

For the industrial sector, the use of B7 biodiesel involves a mixture of seven per cent PME and 93 per cent petroleum diesel.

The increased biodiesel usage is also expected to raise domestic palm oil consumption, with the B15 implementation requiring an estimated 0.801 million metric tonnes annually compared to 0.534 million metric tonnes annually for B10.

The B20 implementation will see palm oil usage reaching an estimated 1.068 million metric tonnes annually, which would help stabilise domestic palm oil demand while supporting the income of smallholders and other players in the country’s palm oil industry.

The government is now targeting to implement the B30 mandate for the land transport sector by 2030 in line with the National Agricommodity Policy, the National Energy Policy, and the country’s energy transition and low-carbon development aspirations. - Bernama","PUTRAJAYA: The B15 biodiesel implementation in Peninsular Malaysia starting June 1 is set to strengthen the country’s energy security without affecting palm oil export volume while also helping to support the local palm oil industry and accelerate the national green agenda.
She said the government had conducted a detailed analysis regarding the implementation, including the country’s palm oil supply capacity, to ensure that exports of the commodity would not be affected.
""We produce about 20 million metric tonnes of palm oil annually and export around 16 million metric tonnes.
Noraini said the B15 implementation is also expected to help boost demand for local palm oil while reducing the country’s dependence on imported fossil-based diesel.
The B20 implementation will see palm oil usage reaching an estimated 1.068 million metric tonnes annually, which would help stabilise domestic palm oil demand while supporting the income of smallholders and other players in the country’s palm oil industry.","['oil', 'malaysia', 'million', 'peninsular', 'b15', 'tonnes', 'cent', 'affect', 'countrys', 'exports', 'palm', 'metric', 'biodiesel', 'implementation']"
Malaysia's April trade hits record RM336.73bil on strong E&E exports,https://www.thestar.com.my/business/business-news/2026/05/20/malaysia039s-april-trade-hits-record-rm33673bil-on-strong-ee-exports,"KUALA LUMPUR: Malaysia's trade rose 28.6 per cent year-on-year (y-o-y) to a record RM336.73 billion in April 2026, driven mainly by strong exports of electrical and electronic (E&E) products, according to the Ministry of Investment, Trade and Industry (MITI).",2026-05-20T05:13:00Z,The Star,"KUALA LUMPUR: Malaysia’s trade rose 28.6 per cent year-on-year (y-o-y) to a record RM336.73 billion in April 2026, driven mainly by strong exports of electrical and electronic (E&E) products, according to the Ministry of Investment, Trade and Industry (MITI).

In a statement today, MITI said Malaysia’s trade maintained strong momentum in April 2026 despite heightened global uncertainties, including geopolitical tensions in West Asia that led to higher logistics costs, supply chain disruptions and commodity price volatility, with exports and imports reaching record highs.

MITI, the ministry overseeing the Malaysia External Trade Development Corporation (MATRADE), said exports extended their growth momentum for the 10th consecutive month, surging 36.9 per cent to a record RM182.74 billion, surpassing the previous high of RM152.77 billion recorded in December 2025 by RM30 billion, while imports rose 20 per cent to RM153.99 billion.

MITI also said this resulted in a trade surplus of RM28.75 billion, marking the 72nd consecutive month of surplus since May 2020.

""The growth in exports was primarily driven by double-digit expansion in major export products, led by E&E products, which increased by RM28 billion to a record high on the back of strong demand from the artificial intelligence (AI) and automotive electronics segments.

""The expansion was further bolstered by remarkable increases in exports of petroleum products, manufactures of metal, optical and scientific equipment, as well as machinery, equipment and parts,” it said.

MITI added that exports of optical and scientific equipment, as well as machinery, equipment and parts, recorded their highest monthly values on record.

The ministry said exports to all major trading partners, namely ASEAN, China, the United States (US), Taiwan and the European Union (EU), recorded strong double-digit growth, with shipments to ASEAN, Taiwan and the EU reaching record highs.

""Malaysia’s extensive network of free trade agreements (FTAs) continued to facilitate market access and diversify export destinations.

""Leveraging these agreements, exports to FTA partners, such as Hong Kong, South Korea, Australia, India and Turkiye, continued to expand, reaching record highs on sustained demand across a broad range of products,” MITI said.

For the January-April 2026 period, MITI said Malaysia’s trade surpassed the RM1 trillion mark within four months, earlier than in the previous year.

Trade during the period rose 15.3 per cent to RM1.127 trillion, with exports increasing 19 per cent to RM609.31 billion and imports growing 11.1 per cent to RM517.40 billion.

""Consequently, the trade surplus doubled from the previous year to RM91.92 billion. Trade, exports, imports and the trade surplus all recorded their highest levels for the period,” it said.

MITI said that despite these positive developments, the ministry and MATRADE would continue to closely monitor global trade developments and remain proactive in safeguarding Malaysia’s trade resilience to sustain its growth momentum. - Bernama","KUALA LUMPUR: Malaysia’s trade rose 28.6 per cent year-on-year (y-o-y) to a record RM336.73 billion in April 2026, driven mainly by strong exports of electrical and electronic (E&E) products, according to the Ministry of Investment, Trade and Industry (MITI).
MITI also said this resulted in a trade surplus of RM28.75 billion, marking the 72nd consecutive month of surplus since May 2020.
MITI added that exports of optical and scientific equipment, as well as machinery, equipment and parts, recorded their highest monthly values on record.
""Consequently, the trade surplus doubled from the previous year to RM91.92 billion.
Trade, exports, imports and the trade surplus all recorded their highest levels for the period,” it said.","['ee', 'malaysias', 'billion', 'hits', 'surplus', 'cent', 'record', 'trade', 'exports', 'rm33673bil', 'products', 'recorded', 'strong', 'ministry']"
