title,url,description,publishedAt,source,text,summary,keywords
Standard Chartered Malaysia backs SMEs through Bank Negara relief facility,https://www.thestar.com.my/business/business-news/2026/05/21/standard-chartered-malaysia-backs-smes-through-bank-negara-relief-facility,"KUALA LUMPUR: Standard Chartered Malaysia is supporting eligible small and medium enterprises (SMEs), including micro-enterprises, through Bank Negara Malaysia's SME Stabilisation Relief Facility (SME SRF).",2026-05-21T07:09:00Z,The Star,"KUALA LUMPUR: Standard Chartered Malaysia is supporting eligible small and medium enterprises (SMEs), including micro-enterprises, through Bank Negara Malaysia’s SME Stabilisation Relief Facility (SME SRF).

In a statement, the bank said the SME SRF is part of BNM’s broader RM5bil financing initiative for affected SMEs and aims to help viable businesses manage short-term cash flow disruptions and sustain operations amid economic uncertainties arising from the ongoing West Asia conflict.

Under the facility, eligible businesses may obtain financing of up to RM750,000 for a tenure of up to five years, at a maximum financing rate of 3.75% per annum, inclusive of guarantee fees.

The financing is backed by guarantees of up to 80% from Credit Guarantee Corporation Malaysia Bhd or Syarikat Jaminan Pembiayaan Perniagaan Bhd, particularly for SMEs without sufficient collateral.

Applications opened on May 15 and will remain available until Dec 31, 2026, or until the facility is fully utilised.

Mushahid Syed, interim chief executive officer, head of coverage and chief financial officer of Standard Chartered Malaysia, said SMEs play a key role in the country’s economy.

“SMEs play a vital role in Malaysia’s economy and in supporting jobs, supply chains and communities across the country,” he said.

“In a more challenging operating environment, timely access to working capital can make a meaningful difference in helping businesses manage cash flow pressures and continue operating with confidence.”

He added that the bank is committed to supporting eligible clients with practical financing solutions and encouraged businesses facing financial stress to engage early with the bank to explore available support options.

SMEs seeking more information or assistance on the application process may contact their relationship managers or visit Standard Chartered Malaysia’s website.

It was reported recently that Standard Chartered plans to cut more than 7,000 jobs globally over the next four years as it steps up automation and the adoption of artificial intelligence (AI), while targeting higher long-term returns and growth.

Commenting on the news, Standard Chartered said its workforce-reshaping efforts and AI investments are part of a broader strategy to drive long-term growth, productivity, and efficiency.

The bank said there are “no specific market targets”, adding that the bank remains committed to investing in Malaysia and Asean to support business growth.

“Within Malaysia and Asean, we remain committed to investing to support business growth, in line with global aspirations.

“We will continue to hire more relationship managers, accelerate product innovation, improve our digital and client experience, as well as upgrade and launch new client centres,” it said.

According to Standard Chartered, the move aligns with Malaysia’s push to build a digitally fluent workforce as the bank expands the use of automation, analytics and AI while investing in reskilling and redeployment initiatives.

“In Malaysia, we empower our employees to adapt, innovate, and thrive in a rapidly evolving landscape by investing in their development and career growth plans,” it said.

“As we do this, our workforce and the work will evolve. We recognise the uncertainty this can create. We are supporting our people through change, with respect and care. Some roles will reduce, others will grow, and new ones will emerge,” the bank added.","KUALA LUMPUR: Standard Chartered Malaysia is supporting eligible small and medium enterprises (SMEs), including micro-enterprises, through Bank Negara Malaysia’s SME Stabilisation Relief Facility (SME SRF).
Mushahid Syed, interim chief executive officer, head of coverage and chief financial officer of Standard Chartered Malaysia, said SMEs play a key role in the country’s economy.
SMEs seeking more information or assistance on the application process may contact their relationship managers or visit Standard Chartered Malaysia’s website.
Commenting on the news, Standard Chartered said its workforce-reshaping efforts and AI investments are part of a broader strategy to drive long-term growth, productivity, and efficiency.
The bank said there are “no specific market targets”, adding that the bank remains committed to investing in Malaysia and Asean to support business growth.","['malaysia', 'facility', 'malaysias', 'relief', 'businesses', 'bank', 'financing', 'backs', 'smes', 'negara', 'supporting', 'investing', 'chartered', 'standard']"
Bank Negara revises policy to strengthen transparency standards for digital platforms,https://www.thestar.com.my/business/business-news/2026/05/21/bank-negara-revises-policy-to-strengthen-transparency-standards-for-digital-platforms,"​KUALA LUMPUR: The revised policy document on product transparency and disclosure sets standards for digital platform operators to disclose key information to consumers throughout the product life cycle, said a Bank Negara Malaysia (BNM) spokesperson.",2026-05-21T05:59:00Z,The Star,"​KUALA LUMPUR: The revised policy document on product transparency and disclosure sets standards for digital platform operators to disclose key information to consumers throughout the product life cycle, said a Bank Negara Malaysia (BNM) spokesperson.

​She said that digital platforms need to ensure promotional materials are clear and not misleading, while also outlining product-specific disclosure requirements for financial products.

​""Three key disclosure principles are that disclosure must be timely, clear and simple; information disclosed must be accurate, relevant and sufficient; and disclosure must be consistent and comparable,"" she said during the BNM Media Workshop on ""Raising the Bar for Consumers: Stronger Protection and Fair Conduct Reforms"" at Sasana Kijang today.

​She also highlighted that the amendments to product transparency and disclosure policy include the introduction of digital disclosure requirements, which aim to ensure that all product disclosures via digital channels are compatible and optimised for the medium used.

​""This includes ensuring consumers are adequately assisted in the digital environment, such as through hotlines, live chat and other interactive tools.

​""Another highlight is the enhanced requirements for sharing customer information for marketing and promotional activities aimed at giving consumers greater control and protecting their privacy,"" she added.

​She explained that financial service providers (FSPs) must also obtain a consumer's prior written consent before disclosing their information to group entities or third parties for marketing purposes.

​""Such consent must also be specific, voluntary, explicit and revocable,"" she said.

​Another highlight of the amendments is the strengthening of requirements for the Product Disclosure Sheet (PDS), ensuring key product features, risks, and terms are presented clearly and concisely.

​""FSPs must take adequate, risk-based measures to ensure consumers read and understand the PDS before entering into a contract.

​""Lastly, a standardised PDS template ensures uniformity and ease of comparison for consumers across different FSPs, with FSPs required to follow the prescribed PDS format and comply with the parameters set out,"" she said. - Bernama","​KUALA LUMPUR: The revised policy document on product transparency and disclosure sets standards for digital platform operators to disclose key information to consumers throughout the product life cycle, said a Bank Negara Malaysia (BNM) spokesperson.
​She said that digital platforms need to ensure promotional materials are clear and not misleading, while also outlining product-specific disclosure requirements for financial products.
​She also highlighted that the amendments to product transparency and disclosure policy include the introduction of digital disclosure requirements, which aim to ensure that all product disclosures via digital channels are compatible and optimised for the medium used.
​Another highlight of the amendments is the strengthening of requirements for the Product Disclosure Sheet (PDS), ensuring key product features, risks, and terms are presented clearly and concisely.
​""FSPs must take adequate, risk-based measures to ensure consumers read and understand the PDS before entering into a contract.","['revises', 'requirements', 'fsps', 'policy', 'transparency', 'bank', 'pds', 'ensure', 'platforms', 'disclosure', 'digital', 'consumers', 'standards', 'information', 'key', 'strengthen', 'negara', 'product']"
"MSMEs can apply for RM5bil SME relief facility until Dec 2026, says Sim",https://www.thestar.com.my/news/nation/2026/05/16/msmes-can-apply-for-rm5bil-sme-relief-facility-until-dec-2026-says-sim,"PUTRAJAYA: Bank Negara Malaysia's (BNM) RM5bil SME Stabilisation Relief Facility (SME SRF) is open for applications by micro, small and medium enterprises (MSMEs) from May 16 until Dec 31, 2026.",2026-05-16T04:21:00Z,The Star,"PUTRAJAYA: Bank Negara Malaysia's (BNM) RM5bil SME Stabilisation Relief Facility (SME SRF) is open for applications by micro, small and medium enterprises (MSMEs) from May 16 until Dec 31, 2026.

Entrepreneur Development and Cooperatives Minister Steven Sim said eligible MSMEs could apply for financing of up to RM750,000 at a maximum interest or profit rate of 3.7% per annum.

The facility will be channelled through 18 participating financial institutions, including Bank Kerjasama Rakyat Malaysia Berhad (Bank Rakyat) and SME Bank under the ministry.

""MSMEs can apply for the financing from May 15 until Dec 31, 2026, or until the RM5bil allocation is fully utilised,"" he said in a statement on Saturday (May 16).

Sim also urged participating financial institutions to speed up the application, approval and disbursement processes under the SME SRF through faster, more flexible and MSME-friendly procedures to ensure assistance reaches businesses affected by current economic uncertainties quickly.

He said his ministry hoped financial institutions would continue to play their role as strategic partners to MSMEs by adopting a more inclusive and practical approach in assessing financing applications.

The new RM5bil fund from BNM, together with an additional RM5 billion guarantee by the Credit Guarantee Corporation Malaysia Berhad (SJPP), has increased the total allocation and funding for the MSME sector this year to RM60bil, compared with RM50 billion announced under Budget 2026. – Bernama","PUTRAJAYA: Bank Negara Malaysia's (BNM) RM5bil SME Stabilisation Relief Facility (SME SRF) is open for applications by micro, small and medium enterprises (MSMEs) from May 16 until Dec 31, 2026.
Entrepreneur Development and Cooperatives Minister Steven Sim said eligible MSMEs could apply for financing of up to RM750,000 at a maximum interest or profit rate of 3.7% per annum.
The facility will be channelled through 18 participating financial institutions, including Bank Kerjasama Rakyat Malaysia Berhad (Bank Rakyat) and SME Bank under the ministry.
""MSMEs can apply for the financing from May 15 until Dec 31, 2026, or until the RM5bil allocation is fully utilised,"" he said in a statement on Saturday (May 16).
Sim also urged participating financial institutions to speed up the application, approval and disbursement processes under the SME SRF through faster, more flexible and MSME-friendly procedures to ensure assistance reaches businesses affected by current economic uncertainties quickly.","['facility', 'rakyat', 'msmes', 'relief', '2026', 'bank', 'financing', 'participating', 'sme', 'sim', 'dec', 'rm5bil', 'financial', 'apply', 'srf', 'institutions']"
Ringgit closes mostly higher against major currencies on strong GDP data,https://www.thestar.com.my/business/business-news/2026/05/15/ringgit-closes-mostly-higher-against-major-currencies-on-strong-gdp-data,"KUALA LUMPUR: The ringgit closed mostly higher against major currencies after Bank Negara Malaysia announced that Malaysia's economy expanded by 5.4 per cent in the first quarter of 2026 (1Q 2026), exceeding the advance estimate of 5.3 per cent, driven by robust domestic demand, investment activities and exports.",2026-05-15T10:53:00Z,The Star,"KUALA LUMPUR: The ringgit closed mostly higher against major currencies after Bank Negara Malaysia announced that Malaysia’s economy expanded by 5.4 per cent in the first quarter of 2026 (1Q 2026), exceeding the advance estimate of 5.3 per cent, driven by robust domestic demand, investment activities and exports.

However, the local note was lower against the US dollar today amid continued support for the greenback on expectations that the US Federal Reserve (Fed) would maintain its restrictive monetary stance.

At 6 pm, the ringgit depreciated to 3.9515/9580 against the greenback from 3.9300/9330 at Thursday’s close.

Earlier today, BNM reported that Malaysia’s economy expanded by 5.4 per cent, with household spending remaining resilient amid favourable labour market conditions and continued policy support, while investment activity was sustained by machinery and equipment spending, structures investment and the implementation of multi-year projects.

The central bank said private consumption expanded by 4.7 per cent in 1Q 2026, while private investment grew 7.8 per cent. Net exports surged 13.5 per cent amid steady export growth and a faster moderation in imports.

Bank Muamalat Malaysia Bhd chief economist Dr Mohd Afzanizam Abdul Rashid said strong US retail sales growth of 4.9 per cent year-on-year in April suggests that the Fed is likely to maintain its restrictive stance this year, providing support for the US dollar.

""Meanwhile, the recent meeting between US President Donald Trump and his Chinese counterpart Xi Jinping appeared cordial, suggesting that trade relations between the two countries remain fairly conducive for now,” he told Bernama.

At the close, the ringgit traded mostly higher against a basket of major currencies.

It appreciated against the British pound to 5.2749/2835 from 5.3094/3135, and rose against the euro to 4.5948/6024 from 4.6009/6044 at Thursday’s close.

However, it slid against the Japanese yen to 2.4927/4968 from 2.4886/4907 previously.

The local currency traded mostly lower against its regional peers.

It rose against the Thai baht to 12.0989/1247 from 12.1506/1652, but eased against the Singapore dollar to 3.0871/0927 from 3.0867/0893, shed against the Indonesian rupiah to 224.5/225.0 from 224.1/224.4 and was lower against the Philippine peso at 6.40/6.41 from 6.37/6.38. - Bernama","However, the local note was lower against the US dollar today amid continued support for the greenback on expectations that the US Federal Reserve (Fed) would maintain its restrictive monetary stance.
At 6 pm, the ringgit depreciated to 3.9515/9580 against the greenback from 3.9300/9330 at Thursday’s close.
The central bank said private consumption expanded by 4.7 per cent in 1Q 2026, while private investment grew 7.8 per cent.
Net exports surged 13.5 per cent amid steady export growth and a faster moderation in imports.
At the close, the ringgit traded mostly higher against a basket of major currencies.","['higher', 'closes', 'lower', '2026', 'major', 'expanded', 'gdp', 'traded', 'ringgit', 'cent', 'currencies', 'support', 'strong', 'investment', 'amid', 'data', 'today']"
UOB Malaysia enhances financing support for SMEs,https://www.thestar.com.my/business/business-news/2026/05/15/uob-malaysia-enhances-financing-support-for-smes,KUALA LUMPUR: UOB Malaysia today announced enhanced financing support for small- and medium-sized enterprises (SME) through Bank Negara Malaysia (BNM) SME Stabilisation Relief Facility (SRF). The facility provides targeted assistance to help businesses strengthen cash flow and sustain operations amid ongoing economic uncertainties.,2026-05-15T08:22:00Z,The Star,"KUALA LUMPUR: UOB Malaysia today announced enhanced financing support for small- and medium-sized enterprises (SME) through Bank Negara Malaysia (BNM) SME Stabilisation Relief Facility (SRF). The facility provides targeted assistance to help businesses strengthen cash flow and sustain operations amid ongoing economic uncertainties.

The BNM SME SRF aims to provide timely financial support to SMEs experiencing disruption and financial strain, particularly those affected by external pressures such as the West Asia conflict, which has impacted revenue streams and operational stability for many businesses.

Ms Ng Wei Wei, Chief Executive Officer, UOB Malaysia, said, ""In today’s increasingly uncertain environment, we understand the very real challenges our customers are facing. Through facilities like the Bank Negara Malaysia SME Stabilisation Relief Facility, we are working to channel timely, practical support to help businesses manage cash flow pressures, sustain operations and build resilience for the future. Building on our earlier relief assistance efforts, we remain focused on supporting our customers every step of the way as they navigate evolving market conditions.”

Under the BNM SME SRF, customers may access financing of up to RM750,000 at a rate of up to 3.75% per annum, inclusive of the guarantee fee, with a financing tenure of up to five years. The facility is supported by guarantee coverage from either Syarikat Jaminan Pembiayaan Perniagaan Berhad (SJPP) or Credit Guarantee Corporation Malaysia Berhad (CGC).

Application is now opened to SMEs interested in the BNM SME SRF. They can reach out to their UOB Relationship Managers or contact the bank via email at businessbanking.servicecentre@uob.com.my. More information on UOB’s financial relief assistance programme is available at uob.com.my. - Bernama","KUALA LUMPUR: UOB Malaysia today announced enhanced financing support for small- and medium-sized enterprises (SME) through Bank Negara Malaysia (BNM) SME Stabilisation Relief Facility (SRF).
Ms Ng Wei Wei, Chief Executive Officer, UOB Malaysia, said, ""In today’s increasingly uncertain environment, we understand the very real challenges our customers are facing.
Through facilities like the Bank Negara Malaysia SME Stabilisation Relief Facility, we are working to channel timely, practical support to help businesses manage cash flow pressures, sustain operations and build resilience for the future.
The facility is supported by guarantee coverage from either Syarikat Jaminan Pembiayaan Perniagaan Berhad (SJPP) or Credit Guarantee Corporation Malaysia Berhad (CGC).
Application is now opened to SMEs interested in the BNM SME SRF.","['malaysia', 'facility', 'relief', 'financing', 'sme', 'smes', 'guarantee', 'support', 'enhances', 'uob', 'bnm', 'srf']"
"Ringgit supported by Malaysia's strong economic outlook, reform momentum - Bank Negara",https://www.thestar.com.my/business/business-news/2026/05/15/ringgit-supported-by-malaysia039s-strong-economic-outlook-reform-momentum---bank-negara,"KUALA LUMPUR: Malaysia's firm economic prospects and sustained reform momentum are expected to provide enduring support to the ringgit, while external factors will continue to drive exchange rate movements, said Bank Negara Malaysia (BNM).",2026-05-15T04:28:00Z,The Star,"KUALA LUMPUR: Malaysia’s firm economic prospects and sustained reform momentum are expected to provide enduring support to the ringgit, while external factors will continue to drive exchange rate movements, said Bank Negara Malaysia (BNM).

In a statement, the central bank said the ringgit strengthened against Malaysia’s major trading partners’ currencies in the first quarter of 2026 (1Q 2026), as reflected in the 1.4 per cent nominal effective exchange rate (NEER) appreciation.

The local note also appreciated by 0.5 per cent against the US dollar during the quarter, despite the dollar strengthening following the onset of the West Asia conflict amid risk-off sentiment.

""The ringgit’s appreciation was supported by Malaysia’s strong domestic fundamentals and growth momentum, alongside continued non-resident inflows into domestic markets.

""Notwithstanding some volatility following the West Asia conflict and reduced expectations for the United States Federal Reserve policy rate cuts, the ringgit has performed well on a year-to-date basis, appreciating by 3.3 per cent against the US dollar and 2.9 per cent on a NEER basis as of May 13, 2026,"" it said.

BNM said it will closely monitor global developments and remains committed to ensuring the orderly functioning of the domestic foreign exchange market.

Meanwhile, the central bank also reported that the financial sector continues to support the financing needs of the economy, with credit growth to the private non-financial sector rising to 5.6 per cent in 1Q 2026 (4Q 2025: 5.3 per cent) following higher growth in outstanding loans (5.6 per cent; 4Q 2026: 4.9 per cent), particularly among businesses.

It said business loans expanded by 5.8 per cent in 1Q 2026 (4Q 2025: 3.9 per cent), mainly due to higher loan growth among non-small and medium enterprises (SMEs), while SME’s loan growth was broadly sustained at 6.0 per cent (4Q 2025: 5.9 per cent).

For households, loan growth remained stable at 5.4 per cent in 1Q 2026 (4Q 2025: 5.5 per cent), with steady loan growth across most purposes, it added.

""Growth in outstanding corporate bonds moderated to 5.8 per cent in 1Q 2026 (4Q 2025: 6.9 per cent) amid lower issuances in the quarter,"" BNM said.

Meanwhile, the banking sector continues to support customers through targeted and tailored measures to provide cash-flow relief, sustain business continuity, and preserve long-term financial viability.

It said financial institutions are offering repayment flexibility, financing restructuring, and advisory services to help customers and SMEs manage cash flow challenges.

Borrowers can also seek assistance through the Debt Management Programme and Small Debt Resolution Scheme offered by the Credit Counselling and Debt Management Agency.

In addition, the RM5 billion SME Stabilisation Relief Facility (SME SRF) is now open for applications through participating financial institutions, providing timely working capital support to viable SMEs affected by the ongoing West Asia conflict, alongside efforts to strengthen long-term SME resilience through structural reforms.

""BNM is working with the Credit Guarantee Corporation Malaysia Bhd (CGC) to introduce a RM10 billion guarantee scheme, which comprises six portfolio guarantee schemes addressing financial inclusion, climate and sustainability, productivity as well as resilience, and will be available to SMEs from June 1, 2026.

""Further information on the scheme will be announced in due course,"" it said. - Bernama","KUALA LUMPUR: Malaysia’s firm economic prospects and sustained reform momentum are expected to provide enduring support to the ringgit, while external factors will continue to drive exchange rate movements, said Bank Negara Malaysia (BNM).
In a statement, the central bank said the ringgit strengthened against Malaysia’s major trading partners’ currencies in the first quarter of 2026 (1Q 2026), as reflected in the 1.4 per cent nominal effective exchange rate (NEER) appreciation.
""The ringgit’s appreciation was supported by Malaysia’s strong domestic fundamentals and growth momentum, alongside continued non-resident inflows into domestic markets.
For households, loan growth remained stable at 5.4 per cent in 1Q 2026 (4Q 2025: 5.5 per cent), with steady loan growth across most purposes, it added.
""Growth in outstanding corporate bonds moderated to 5.8 per cent in 1Q 2026 (4Q 2025: 6.9 per cent) amid lower issuances in the quarter,"" BNM said.","['outlook', '2026', 'momentum', 'support', '1q', 'loan', 'economic', 'cent', 'malaysias', 'bank', '2025', 'financial', 'negara', 'reform', 'ringgit', 'smes', '4q', 'supported', 'strong', 'growth']"
